{"schema_version":"0.6","id":"disable-critic-v1","baseline_topology_sha256":"6666666666666666666666666666666666666666666666666666666666666666","candidate_topology_sha256":"7777777777777777777777777777777777777777777777777777777777777777","changed_variables":["/agents/critic"],"control_hashes":{"episodes":"8888888888888888888888888888888888888888888888888888888888888888","seeds":"9999999999999999999999999999999999999999999999999999999999999999","budgets":"aaaaaaaaaaaaaaaaaaaaaaaaaaaaaaaaaaaaaaaaaaaaaaaaaaaaaaaaaaaaaaaa","models":"bbbbbbbbbbbbbbbbbbbbbbbbbbbbbbbbbbbbbbbbbbbbbbbbbbbbbbbbbbbbbbbb","managed_tool_policy":"cccccccccccccccccccccccccccccccccccccccccccccccccccccccccccccccc","scoring_profile":"dddddddddddddddddddddddddddddddddddddddddddddddddddddddddddddddd","execution_policy":"eeeeeeeeeeeeeeeeeeeeeeeeeeeeeeeeeeeeeeeeeeeeeeeeeeeeeeeeeeeeeeee","schemas":"ffffffffffffffffffffffffffffffffffffffffffffffffffffffffffffffff","binaries":"0123456789abcdef0123456789abcdef0123456789abcdef0123456789abcdef"},"paired_cell_ids":["cell:1111111111111111111111111111111111111111111111111111111111111111","cell:2222222222222222222222222222222222222222222222222222222222222222"]}
