{
  "schema_version": "0.6",
  "id": "supervisor-specialist-addition-v1",
  "baseline_topology_sha256": "d09ed0d9e0ed4c0bb184384e01f140d9b9c1abb63b3e9bdabc04f96485e18081",
  "candidate_topology_sha256": "236fbbfd4356087c89fb668e7d7d8e89f1b0cd47ea714afcd778649f0f2b1a42",
  "changed_variables": [
    "/agents",
    "/execution_pattern",
    "/id",
    "/kind",
    "/relationships",
    "/task_allocation"
  ],
  "control_hashes": {
    "episodes": "1111111111111111111111111111111111111111111111111111111111111111",
    "seeds": "2222222222222222222222222222222222222222222222222222222222222222",
    "budgets": "3333333333333333333333333333333333333333333333333333333333333333",
    "models": "4444444444444444444444444444444444444444444444444444444444444444",
    "managed_tool_policy": "5555555555555555555555555555555555555555555555555555555555555555",
    "scoring_profile": "f49e1c009ca684ccd54336fd7c40d1ce7df4a2d52ba6ef65a4afd20556476f1d",
    "execution_policy": "6666666666666666666666666666666666666666666666666666666666666666",
    "schemas": "7777777777777777777777777777777777777777777777777777777777777777",
    "binaries": "8888888888888888888888888888888888888888888888888888888888888888"
  },
  "paired_cell_ids": [
    "cell:0000000000000000000000000000000000000000000000000000000000000001",
    "cell:0000000000000000000000000000000000000000000000000000000000000002",
    "cell:0000000000000000000000000000000000000000000000000000000000000003",
    "cell:0000000000000000000000000000000000000000000000000000000000000004",
    "cell:0000000000000000000000000000000000000000000000000000000000000005",
    "cell:0000000000000000000000000000000000000000000000000000000000000006",
    "cell:0000000000000000000000000000000000000000000000000000000000000007",
    "cell:0000000000000000000000000000000000000000000000000000000000000008",
    "cell:0000000000000000000000000000000000000000000000000000000000000009",
    "cell:000000000000000000000000000000000000000000000000000000000000000a",
    "cell:000000000000000000000000000000000000000000000000000000000000000b",
    "cell:000000000000000000000000000000000000000000000000000000000000000c",
    "cell:000000000000000000000000000000000000000000000000000000000000000d",
    "cell:000000000000000000000000000000000000000000000000000000000000000e",
    "cell:000000000000000000000000000000000000000000000000000000000000000f",
    "cell:1000000000000000000000000000000000000000000000000000000000000000",
    "cell:2000000000000000000000000000000000000000000000000000000000000000",
    "cell:3000000000000000000000000000000000000000000000000000000000000000",
    "cell:4000000000000000000000000000000000000000000000000000000000000000",
    "cell:5000000000000000000000000000000000000000000000000000000000000000"
  ]
}
